{
  "schema_version": "1.0",
  "skill": "research-brief",
  "status": "ready",
  "title": "Which fictional caption tool should a solo creator trial?",
  "summary": "Trial QuillNest first: its supplied AUD 19 monthly plan covers four videos within the AUD 25 budget, with six projects and caption export. [source-1] ClipHarbor advertises more capacity at AUD 29 per month, exceeding the budget. [source-2] These fictional supplied cards do not establish real pricing or caption accuracy, and the creator has tested neither tool. [source-1][source-2][source-3] Caption and export one representative video during the trial before deciding whether to pay.",
  "assumptions": ["Compare only the advertised monthly plans in the supplied fictional snippets; do not consider discounts or annual billing."],
  "questions": [],
  "limitations": ["All evidence is fictional, user-provided text; no product page was accessed or independently verified.", "Neither product card establishes caption accuracy, and the creator has tested neither tool."],
  "data": {
    "question": "Which supplied fictional tool is the better first trial for a solo creator making four videos monthly with an AUD 25 budget and a need for caption export?",
    "scope": "A comparison of advertised fit using exactly three provided snippets, without current-price verification or a purchase recommendation.",
    "answer": "QuillNest is the better first trial for this bounded comparison of advertised fit: its supplied AUD 19 monthly plan includes six projects, caption export, and one user, meeting the creator's four-video workload, AUD 25 budget, and solo workflow. [source-1][source-3] ClipHarbor also advertises caption export and one user, but its AUD 29 monthly price is AUD 4 over budget; its twenty-project allowance adds capacity the stated workload does not require. [source-2] Both cards advertise a seven-day trial, so the supplied trial duration does not favor either option. [source-1][source-2] These are fictional, unverified product claims, neither card establishes transcription accuracy, and the creator reports having tested neither tool. [source-1][source-2][source-3] The recommendation is therefore to trial QuillNest first, not to treat a paid purchase as justified. [source-1][source-2][source-3] Caption and export one representative video, checking correction time, unacceptable errors, and whether the export works in the intended editing workflow before deciding to pay.",
    "findings": [
      {
        "id": "finding-1",
        "type": "fact",
        "text": "The supplied QuillNest card advertises AUD 19 per month, six projects, caption export, one user, and a seven-day trial.",
        "source_ids": ["source-1"]
      },
      {
        "id": "finding-2",
        "type": "fact",
        "text": "The supplied ClipHarbor card advertises AUD 29 per month, twenty projects, caption export, one user, and a seven-day trial.",
        "source_ids": ["source-2"]
      },
      {
        "id": "finding-3",
        "type": "inference",
        "text": "Against the user's AUD 25 budget and four-video workload, QuillNest's advertised plan fits; ClipHarbor costs AUD 4 over budget and offers capacity the stated workload does not require.",
        "source_ids": ["source-1", "source-2"]
      },
      {
        "id": "finding-4",
        "type": "fact",
        "text": "Neither card describes accuracy, and the creator's supplied note says neither tool has been tested.",
        "source_ids": ["source-1", "source-2", "source-3"]
      },
      {
        "id": "finding-5",
        "type": "hypothesis",
        "text": "QuillNest may be sufficient for the creator's actual caption workflow; one trial video could reveal unacceptable transcription errors or export friction.",
        "source_ids": ["source-1", "source-3"]
      }
    ],
    "sources": [
      {"id": "source-1", "title": "Supplied fictional QuillNest product card", "kind": "provided_text", "url": null, "read_at": null, "notes": "Exact source text appears in references/example-input.md. User-provided fictional fixture; no independent verification."},
      {"id": "source-2", "title": "Supplied fictional ClipHarbor product card", "kind": "provided_text", "url": null, "read_at": null, "notes": "Exact source text appears in references/example-input.md. User-provided fictional fixture; no independent verification."},
      {"id": "source-3", "title": "Supplied fictional creator trial note", "kind": "provided_text", "url": null, "read_at": null, "notes": "Exact source text appears in references/example-input.md. User's supplied account of preferences and lack of testing."}
    ],
    "conflicts": [],
    "next_actions": ["During the first trial, caption one representative video and record correction time and any unacceptable errors.", "Export the captions and confirm that the file opens correctly in the creator's intended editing workflow.", "Before paying for any real product, verify its current plan details and trial terms directly."]
  }
}
